{
  "$schema": "https://json-schema.org/draft/2020-12/schema",
  "$id": "https://example.org/awesome-agentic-benchmarks/discovery-task.schema.json",
  "title": "Discovery Task Registry",
  "type": "object",
  "required": ["registry_version", "last_updated", "registry_suites", "tasks"],
  "properties": {
    "$schema": {"type": "string"},
    "registry_version": {"type": "string", "pattern": "^[0-9]+\\.[0-9]+\\.[0-9]+$"},
    "last_updated": {"type": "string", "format": "date"},
    "registry_suites": {
      "type": "array",
      "minItems": 1,
      "items": {
        "type": "object",
        "required": ["id", "name", "role", "evaluated_model", "result_status", "paper", "repository", "task_catalogue", "task_contract", "task_count", "public_task_count", "model_families"],
        "properties": {
          "id": {"type": "string", "pattern": "^[a-z0-9]+(?:-[a-z0-9]+)*$"},
          "name": {"type": "string"},
          "role": {"enum": ["task-source", "task-source-and-evaluated-system", "task-package-and-evaluated-system"]},
          "evaluated_model": {"type": ["string", "null"]},
          "result_status": {"enum": ["source-reported", "independently-reproduced", "independently-certified"]},
          "paper": {"type": "string", "format": "uri"},
          "repository": {"type": "string", "format": "uri"},
          "task_catalogue": {"type": "string", "format": "uri"},
          "task_contract": {"type": "string"},
          "task_count": {"type": "integer", "minimum": 1},
          "public_task_count": {"type": "integer", "minimum": 0},
          "model_families": {
            "type": "array",
            "items": {"enum": ["gpt", "claude", "glm", "kimi", "qwen", "gemini", "deepseek", "xai", "other"]},
            "uniqueItems": true
          },
          "aggregate_results": {
            "type": "array",
            "items": {"$ref": "#/$defs/result"}
          },
          "notes": {"type": "string"}
        },
        "additionalProperties": false
      }
    },
    "tasks": {
      "type": "array",
      "minItems": 1,
      "items": {"$ref": "#/$defs/task"}
    }
  },
  "additionalProperties": false,
  "$defs": {
    "task": {
      "type": "object",
      "required": [
        "id", "name", "domain", "registry_suite", "task_origin", "task_url", "question", "input", "output",
        "metric", "evaluation", "environment", "reference_result", "reported_result",
        "outcome", "evidence_urls", "integrity_notes"
      ],
      "properties": {
        "id": {"type": "string", "pattern": "^[a-z0-9]+(?:-[a-z0-9]+)*$"},
        "name": {"type": "string", "minLength": 3},
        "domain": {
          "enum": [
            "quantum-compilation", "astrodynamics", "scientific-algorithms",
            "ai-foundations", "mathematics-discovery", "interactive-world-discovery"
          ]
        },
        "task_type": {
          "enum": ["artifact-optimization", "interactive-rule-discovery", "scientific-investigation", "environment-learning"]
        },
        "registry_suite": {"type": "string", "pattern": "^[a-z0-9]+(?:-[a-z0-9]+)*$"},
        "task_origin": {"type": "string", "minLength": 3},
        "task_url": {"type": "string", "format": "uri"},
        "question": {"type": "string", "minLength": 10},
        "input": {"type": "string", "minLength": 10},
        "output": {"type": "string", "minLength": 3},
        "metric": {
          "type": "object",
          "required": ["name", "direction", "unit"],
          "properties": {
            "name": {"type": "string"},
            "direction": {"enum": ["minimize", "maximize"]},
            "unit": {"type": "string"}
          },
          "additionalProperties": false
        },
        "evaluation": {"type": "string", "minLength": 10},
        "environment": {"type": "string", "minLength": 3},
        "reference_result": {"oneOf": [{"$ref": "#/$defs/result"}, {"type": "null"}]},
        "reported_result": {"oneOf": [{"$ref": "#/$defs/result"}, {"type": "null"}]},
        "outcome": {"enum": ["improved", "matched-reference", "below-reference", "not-yet-scored"]},
        "evidence_urls": {
          "type": "array",
          "minItems": 1,
          "items": {"type": "string", "format": "uri"},
          "uniqueItems": true
        },
        "integrity_notes": {"type": "string"}
      },
      "additionalProperties": false
    },
    "result": {
      "type": "object",
      "required": ["system", "score"],
      "properties": {
        "system": {"type": "string"},
        "score": {"type": "number"}
      },
      "additionalProperties": false
    }
  }
}
