{
  "$schema": "../schema/discovery-task.schema.json",
  "registry_version": "0.3.0",
  "last_updated": "2026-08-25",
  "registry_suites": [
    {
      "id": "arc-agi-3",
      "name": "ARC-AGI-3",
      "role": "task-source",
      "evaluated_model": null,
      "result_status": "independently-certified",
      "paper": "https://arcprize.org/media/ARC_AGI_3_Technical_Report.pdf",
      "repository": "https://github.com/arcprize/ARC-AGI",
      "task_catalogue": "https://docs.arcprize.org/available-games",
      "task_contract": "An agent receives a turn-based 64x64-or-smaller 16-color frame and available actions, but no natural-language objective or mechanics. It must discover the world rules and win condition, then complete levels efficiently.",
      "task_count": 135,
      "public_task_count": 25,
      "model_families": ["gpt", "claude", "gemini", "xai"],
      "aggregate_results": [
        {"system": "Anthropic Opus 4.6 (Max), official semi-private", "score": 0.5},
        {"system": "Gemini 3.1 Pro Preview, official semi-private", "score": 0.4},
        {"system": "OpenAI GPT-5.4 (High), official semi-private", "score": 0.2},
        {"system": "xAI Grok-4.20 Beta, official semi-private", "score": 0.1}
      ],
      "notes": "The 135 environments comprise 25 public demos, 55 semi-private environments, and 55 fully private environments. Only the three anonymous public examples are itemized here until the remaining public IDs can be authenticated through the official API."
    },
    {
      "id": "dig-bench",
      "name": "DiG-bench",
      "role": "task-source",
      "evaluated_model": null,
      "result_status": "source-reported",
      "paper": "https://arxiv.org/abs/2608.12593",
      "repository": "https://github.com/discos-research/dig-bench",
      "task_catalogue": "https://digbench.ai/",
      "task_contract": "An agent interacts with a text game through JSON states and legal actions, experiments to infer unique hidden transformation rules and win conditions, and must beat the game within its fixed step budget.",
      "task_count": 70,
      "public_task_count": 21,
      "model_families": ["gpt", "claude", "glm", "kimi", "qwen", "gemini", "deepseek"],
      "aggregate_results": [
        {"system": "Claude Opus 5 basic harness, games won out of 70", "score": 50},
        {"system": "Gemini 3.1 Pro basic harness without rules, games won out of 70", "score": 18},
        {"system": "Qwen 3.6 27B basic harness, games won out of 70", "score": 1}
      ],
      "notes": "The public set contains P-1 through P-21, three games in each of seven difficulty tiers. The remaining 49 games are private and are not itemized."
    },
    {
      "id": "simpletes",
      "name": "SimpleTES",
      "role": "task-package-and-evaluated-system",
      "evaluated_model": "gpt-oss-120b",
      "result_status": "source-reported",
      "paper": "https://arxiv.org/abs/2604.19341",
      "repository": "https://github.com/wq-will/SimpleTES",
      "task_catalogue": "https://github.com/wq-will/SimpleTES/blob/main/datasets/README.md",
      "task_contract": "Each task supplies an instruction, an editable seed program, and an executable evaluator that validates constraints and recomputes the score in an isolated subprocess.",
      "task_count": 28,
      "public_task_count": 28,
      "model_families": ["other"],
      "notes": "SimpleTES packages/adapts executable evaluator contracts and reports gpt-oss-120b results. It is not treated as the original provenance of every included task; each task has separate task_origin and task_url fields."
    }
  ],
  "tasks": [
    {
      "id": "asymmetric-matrix-multiplication",
      "name": "Asymmetric matrix multiplication",
      "domain": "ai-foundations",
      "registry_suite": "simpletes",
      "task_origin": "KernelBench L1 / SimpleTES extended-shape contract",
      "task_url": "https://github.com/ScalingIntelligence/KernelBench",
      "question": "Implement a faster asymmetric matrix-multiplication GPU kernel without changing numerical semantics.",
      "input": "A seed Triton/CUDA kernel, fixed tensor shapes and dtypes, correctness tests, and a profiling harness.",
      "output": "GPU kernel source",
      "metric": {"name": "runtime", "direction": "minimize", "unit": "ms"},
      "evaluation": "Correctness-gated execution followed by runtime profiling on the fixed benchmark workload.",
      "environment": "Triton/CUDA with a GPU profiling server; headline result uses H200.",
      "reference_result": {"system": "CUDAAgent", "score": 0.747},
      "reported_result": {"system": "SimpleTES", "score": 0.440},
      "outcome": "improved",
      "evidence_urls": ["https://arxiv.org/abs/2604.19341", "https://github.com/wq-will/SimpleTES/blob/main/best_results/README.md"],
      "integrity_notes": "Runtime depends on hardware and profiler configuration; scores are source-reported and require matched-device replay."
    },
    {
      "id": "batched-cumulative-sum",
      "name": "Batched cumulative sum",
      "domain": "ai-foundations",
      "registry_suite": "simpletes",
      "task_origin": "KernelBench L1 / SimpleTES extended-shape contract",
      "task_url": "https://github.com/ScalingIntelligence/KernelBench",
      "question": "Implement a faster batched prefix-sum GPU kernel while preserving output correctness.",
      "input": "A seed GPU kernel, fixed tensors, correctness tests, and a profiling harness.",
      "output": "GPU kernel source",
      "metric": {"name": "runtime", "direction": "minimize", "unit": "ms"},
      "evaluation": "Correctness-gated execution followed by runtime profiling on the fixed benchmark workload.",
      "environment": "Triton/CUDA with a GPU profiling server; headline result uses H200.",
      "reference_result": {"system": "NVIDIA CUB", "score": 0.147},
      "reported_result": {"system": "SimpleTES", "score": 0.104},
      "outcome": "improved",
      "evidence_urls": ["https://arxiv.org/abs/2604.19341", "https://github.com/wq-will/SimpleTES/blob/main/best_results/README.md"],
      "integrity_notes": "Runtime depends on hardware and profiler configuration; scores are source-reported and require matched-device replay."
    },
    {
      "id": "cassini-trajectory",
      "name": "Cassini gravity-assist trajectory",
      "domain": "astrodynamics",
      "registry_suite": "simpletes",
      "task_origin": "Cassini historical mission / SimpleTES trajectory evaluator",
      "task_url": "https://arxiv.org/html/2604.19341",
      "question": "Find a feasible Cassini gravity-assist trajectory with lower total propulsive cost.",
      "input": "Mission window, body sequence/search variables, orbital constraints, a seed optimizer, and NAIF ephemeris kernels.",
      "output": "Trajectory-design program and feasible mission parameters",
      "metric": {"name": "propulsive cost", "direction": "minimize", "unit": "normalized mission objective"},
      "evaluation": "The mission simulator validates feasibility and computes the fixed propulsive-cost objective.",
      "environment": "Python task environment with astrodynamics dependencies and NAIF kernels.",
      "reference_result": {"system": "Historical sequence", "score": 1.066682},
      "reported_result": {"system": "SimpleTES", "score": 0.820129},
      "outcome": "improved",
      "evidence_urls": ["https://arxiv.org/abs/2604.19341", "https://github.com/wq-will/SimpleTES/blob/main/best_results/README.md"],
      "integrity_notes": "Comparison is meaningful only under the same mission windows, simulator, constraints, and cost normalization."
    },
    {
      "id": "circle-packing-n26",
      "name": "Circle packing in a unit square (n=26)",
      "domain": "mathematics-discovery",
      "registry_suite": "simpletes",
      "task_origin": "Circle-packing problem / EinsteinArena evaluator",
      "task_url": "https://einsteinarena.com/problems/circle-packing",
      "question": "Place 26 non-overlapping circles inside a unit square to maximize the sum of their radii.",
      "input": "A Python seed construction, geometric constraints, and an executable feasibility checker.",
      "output": "Circle centers and radii",
      "metric": {"name": "sum of radii", "direction": "maximize", "unit": "unit-square length"},
      "evaluation": "Recompute boundary and non-overlap constraints, then sum all feasible radii.",
      "environment": "Python; no external task setup listed.",
      "reference_result": {"system": "AlphaEvolve V2", "score": 2.635983},
      "reported_result": {"system": "SimpleTES", "score": 2.635983},
      "outcome": "matched-reference",
      "evidence_urls": ["https://arxiv.org/abs/2604.19341", "https://github.com/wq-will/SimpleTES/blob/main/best_results/README.md"],
      "integrity_notes": "Rounded values match; full-precision artifacts are required to establish equality or a strict improvement."
    },
    {
      "id": "circle-packing-n32",
      "name": "Circle packing in a unit square (n=32)",
      "domain": "mathematics-discovery",
      "registry_suite": "simpletes",
      "task_origin": "Circle-packing problem / AlphaEvolve–EFT contract",
      "task_url": "https://arxiv.org/html/2606.29082",
      "question": "Place 32 non-overlapping circles inside a unit square to maximize the sum of their radii.",
      "input": "A Python seed construction, geometric constraints, and an executable feasibility checker.",
      "output": "Circle centers and radii",
      "metric": {"name": "sum of radii", "direction": "maximize", "unit": "unit-square length"},
      "evaluation": "Recompute boundary and non-overlap constraints, then sum all feasible radii.",
      "environment": "Python; no external task setup listed.",
      "reference_result": {"system": "AlphaEvolve V2", "score": 2.939572},
      "reported_result": {"system": "SimpleTES", "score": 2.939572},
      "outcome": "matched-reference",